{
  "id": "gpt-4-turbo",
  "name": "GPT-4 Turbo",
  "provider": "OpenAI",
  "availability": {
    "status": "generally-available",
    "regions": ["global"],
    "lastUpdated": "2024-12-01"
  },
  "tier": {
    "type": "paid"
  },
  "pricing": {
    "inputTokenPrice": 0.01,
    "outputTokenPrice": 0.03,
    "currency": "USD",
    "unit": "per-1k-tokens",
    "lastUpdated": "2024-12-01"
  },
  "usage": {
    "intendedFor": ["chat", "completion", "code-generation", "analysis", "image-understanding"],
    "capabilities": {
      "contextWindow": 128000,
      "maxOutputTokens": 4096,
      "supportsFunctionCalling": true,
      "supportsVision": true,
      "supportsStreaming": true
    },
    "restrictions": []
  },
  "metadata": {
    "releaseDate": "2023-11-06",
    "documentation": "https://platform.openai.com/docs/models/gpt-4-turbo-and-gpt-4",
    "notes": "GPT-4 Turbo with 128K context window and vision capabilities"
  }
}
