{
  "id": "gpt-3-5-turbo",
  "name": "GPT-3.5 Turbo",
  "provider": "OpenAI",
  "availability": {
    "status": "generally-available",
    "regions": ["global"],
    "lastUpdated": "2024-12-01"
  },
  "tier": {
    "type": "paid"
  },
  "pricing": {
    "inputTokenPrice": 0.0005,
    "outputTokenPrice": 0.0015,
    "currency": "USD",
    "unit": "per-1k-tokens",
    "lastUpdated": "2024-12-01"
  },
  "usage": {
    "intendedFor": ["chat", "completion", "code-generation"],
    "capabilities": {
      "contextWindow": 16385,
      "maxOutputTokens": 4096,
      "supportsFunctionCalling": true,
      "supportsVision": false,
      "supportsStreaming": true
    },
    "restrictions": []
  },
  "metadata": {
    "releaseDate": "2022-11-30",
    "documentation": "https://platform.openai.com/docs/models/gpt-3-5-turbo",
    "notes": "Cost-effective model for most tasks"
  }
}
