{
  "id": "claude-3-haiku",
  "name": "Claude 3 Haiku",
  "provider": "Anthropic",
  "availability": {
    "status": "generally-available",
    "regions": ["global"],
    "lastUpdated": "2024-12-01"
  },
  "tier": {
    "type": "paid"
  },
  "pricing": {
    "inputTokenPrice": 0.00025,
    "outputTokenPrice": 0.00125,
    "currency": "USD",
    "unit": "per-1k-tokens",
    "lastUpdated": "2024-12-01"
  },
  "usage": {
    "intendedFor": ["chat", "completion", "analysis", "image-understanding"],
    "capabilities": {
      "contextWindow": 200000,
      "maxOutputTokens": 4096,
      "supportsFunctionCalling": true,
      "supportsVision": true,
      "supportsStreaming": true
    },
    "restrictions": []
  },
  "metadata": {
    "releaseDate": "2024-03-04",
    "documentation": "https://docs.anthropic.com/claude/docs/models-overview",
    "notes": "Fastest and most cost-effective Claude 3 model"
  }
}
