{
  "id": "gpt-4",
  "name": "GPT-4",
  "provider": "OpenAI",
  "availability": {
    "status": "generally-available",
    "regions": ["global"],
    "lastUpdated": "2024-12-01"
  },
  "tier": {
    "type": "paid"
  },
  "pricing": {
    "inputTokenPrice": 0.03,
    "outputTokenPrice": 0.06,
    "currency": "USD",
    "unit": "per-1k-tokens",
    "lastUpdated": "2024-12-01"
  },
  "usage": {
    "intendedFor": ["chat", "completion", "code-generation", "analysis"],
    "capabilities": {
      "contextWindow": 8192,
      "maxOutputTokens": 4096,
      "supportsFunctionCalling": true,
      "supportsVision": false,
      "supportsStreaming": true
    },
    "restrictions": []
  },
  "metadata": {
    "releaseDate": "2023-03-14",
    "documentation": "https://platform.openai.com/docs/models/gpt-4",
    "notes": "Standard GPT-4 model with 8K context window"
  }
}
